{
  "apiVersion": "agentic-framework.github.com/v1alpha1",
  "kind": "PhaseContract",
  "identity": { "id": "core.planning", "version": "1.0.0" },
  "phase": "planning",
  "compatibleLifecycle": "1.0.0",
  "compatibleLifecycleDigest": "sha256:a0e9a837deebca4a58058edc98d447b9d8295a65a55091fd79fe7c4e8e7ec78d",
  "entryPredicates": ["work-accord-current"],
  "requiredEvidence": ["trusted-binding"],
  "allowedCapabilities": [],
  "inputSchema": {
    "type": "object",
    "additionalProperties": false,
    "required": ["framingDigest"],
    "properties": {
      "framingDigest": { "type": "string", "pattern": "^sha256:[0-9a-f]{64}$" }
    }
  },
  "outputSchema": {
    "type": "object",
    "additionalProperties": false,
    "required": ["steps", "targetSlots", "verificationIds"],
    "properties": {
      "steps": { "type": "array", "items": { "type": "string" } },
      "targetSlots": { "type": "array", "items": { "type": "string" } },
      "verificationIds": { "type": "array", "items": { "type": "string" } }
    }
  },
  "exitRules": [
    { "predicate": "eligible-human-accepts-plan", "event": "execution-authorized" }
  ],
  "limits": { "maxLoops": 1, "maxCalls": 0, "maxCostUnits": 0, "maxParallel": 1 },
  "humanGates": ["accept-plan"],
  "privacy": { "maximumClass": "internal", "retentionDays": 90 }
}
